{
  "schema": "pg/1",
  "subject": "tenement_block",
  "seed": 1,
  "parts": [
    {
      "id": "plinth_left",
      "prim": "bevelBox",
      "dims": [
        9,
        0.9,
        8.3
      ],
      "bevel": 0.06,
      "ground": true,
      "role": "plinth",
      "zone": "foundation"
    },
    {
      "id": "mass_left",
      "prim": "box",
      "dims": [
        9,
        10.8,
        8
      ],
      "role": "massing",
      "zone": "mint",
      "attach": {
        "to": "plinth_left",
        "face": "+Y",
        "uv": [
          0.5,
          0.5
        ],
        "contact": "rests-on-top",
        "embed": 0.05
      }
    },
    {
      "id": "plinth_middle",
      "prim": "bevelBox",
      "dims": [
        7.6,
        0.9,
        8.3
      ],
      "bevel": 0.06,
      "role": "plinth",
      "zone": "stone",
      "attach": {
        "to": "plinth_left",
        "face": "+X",
        "uv": [
          0.5,
          0
        ],
        "contact": "flush",
        "embed": 0.05,
        "align": "bottom"
      }
    },
    {
      "id": "mass_middle",
      "prim": "box",
      "dims": [
        7.6,
        12,
        8
      ],
      "role": "massing",
      "zone": "brick",
      "attach": {
        "to": "plinth_middle",
        "face": "+Y",
        "uv": [
          0.5,
          0.5
        ],
        "contact": "rests-on-top",
        "embed": 0.05
      }
    },
    {
      "id": "plinth_right",
      "prim": "bevelBox",
      "dims": [
        8.4,
        0.9,
        8.3
      ],
      "bevel": 0.06,
      "role": "plinth",
      "zone": "stone",
      "attach": {
        "to": "plinth_middle",
        "face": "+X",
        "uv": [
          0.5,
          0
        ],
        "contact": "flush",
        "embed": 0.05,
        "align": "bottom"
      }
    },
    {
      "id": "mass_right",
      "prim": "box",
      "dims": [
        8.4,
        10.2,
        8
      ],
      "role": "massing",
      "zone": "render",
      "attach": {
        "to": "plinth_right",
        "face": "+Y",
        "uv": [
          0.5,
          0.5
        ],
        "contact": "rests-on-top",
        "embed": 0.05
      }
    },
    {
      "id": "parapet_left",
      "prim": "bevelBox",
      "dims": [
        9,
        0.95,
        8.24
      ],
      "bevel": 0.05,
      "role": "parapet",
      "zone": "stone",
      "attach": {
        "to": "mass_left",
        "face": "+Y",
        "uv": [
          0.5,
          0.5
        ],
        "contact": "rests-on-top",
        "embed": 0.05
      }
    },
    {
      "id": "parapet_middle",
      "prim": "bevelBox",
      "dims": [
        7.6,
        1.15,
        8.24
      ],
      "bevel": 0.05,
      "role": "parapet",
      "zone": "trim",
      "attach": {
        "to": "mass_middle",
        "face": "+Y",
        "uv": [
          0.5,
          0.5
        ],
        "contact": "rests-on-top",
        "embed": 0.05
      }
    },
    {
      "id": "parapet_right",
      "prim": "bevelBox",
      "dims": [
        8.4,
        0.85,
        8.24
      ],
      "bevel": 0.05,
      "role": "parapet",
      "zone": "stone",
      "attach": {
        "to": "mass_right",
        "face": "+Y",
        "uv": [
          0.5,
          0.5
        ],
        "contact": "rests-on-top",
        "embed": 0.05
      }
    },
    {
      "id": "bulkhead_left",
      "prim": "bevelBox",
      "dims": [
        3.2,
        2.4,
        2.8
      ],
      "bevel": 0.05,
      "role": "bulkhead",
      "zone": "mint",
      "attach": {
        "to": "parapet_left",
        "face": "+Y",
        "uv": [
          0.3,
          0.45
        ],
        "contact": "rests-on-top",
        "embed": 0.05
      }
    },
    {
      "id": "basement_window_left",
      "prim": "box",
      "dims": [
        0.9,
        0.5,
        0.12
      ],
      "role": "window",
      "zone": "glass",
      "mirror": true,
      "attach": {
        "to": "plinth_left",
        "face": "+Z",
        "uv": [
          0.25,
          0.45
        ],
        "contact": "socket",
        "embed": 0.06
      }
    },
    {
      "id": "balcony_r2",
      "prim": "bevelBox",
      "dims": [
        2.6,
        0.18,
        1.2
      ],
      "bevel": 0.04,
      "role": "balcony",
      "zone": "stone",
      "attach": {
        "to": "mass_right",
        "face": "+Z",
        "uv": [
          0.5,
          0.313725
        ],
        "contact": "flush",
        "embed": 0.05,
        "align": "bottom"
      }
    },
    {
      "id": "balcony_r3",
      "prim": "bevelBox",
      "dims": [
        2.6,
        0.18,
        1.2
      ],
      "bevel": 0.04,
      "role": "balcony",
      "zone": "stone",
      "attach": {
        "to": "mass_right",
        "face": "+Z",
        "uv": [
          0.5,
          0.627451
        ],
        "contact": "flush",
        "embed": 0.05,
        "align": "bottom"
      }
    },
    {
      "id": "stoop_left",
      "prim": "stepStack",
      "dims": [
        1.6,
        0.78,
        1.2
      ],
      "steps": 4,
      "role": "stoop",
      "zone": "stone",
      "attach": {
        "to": "plinth_left",
        "face": "+Y",
        "uv": [
          0.5,
          0.9939759036144579
        ],
        "contact": "rests-on-top",
        "embed": 0.8,
        "align": "bottom",
        "rot": 180
      }
    },
    {
      "id": "stoop_left_rail",
      "prim": "railing",
      "dims": [
        1.2,
        0.95,
        0.06
      ],
      "role": "railing",
      "zone": "iron",
      "params": {
        "postCount": 2
      },
      "mirror": true,
      "attach": {
        "to": "stoop_left",
        "face": "+Y",
        "uv": [
          0.04,
          0.5
        ],
        "contact": "rests-on-top",
        "rot": 90
      }
    },
    {
      "id": "stoop_right",
      "prim": "stepStack",
      "dims": [
        1.6,
        0.78,
        1.2
      ],
      "steps": 4,
      "role": "stoop",
      "zone": "stone",
      "attach": {
        "to": "plinth_right",
        "face": "+Y",
        "uv": [
          0.5,
          0.9939759036144579
        ],
        "contact": "rests-on-top",
        "embed": 0.8,
        "align": "bottom",
        "rot": 180
      }
    },
    {
      "id": "stoop_right_rail",
      "prim": "railing",
      "dims": [
        1.2,
        0.95,
        0.06
      ],
      "role": "railing",
      "zone": "iron",
      "params": {
        "postCount": 2
      },
      "mirror": true,
      "attach": {
        "to": "stoop_right",
        "face": "+Y",
        "uv": [
          0.04,
          0.5
        ],
        "contact": "rests-on-top",
        "rot": 90
      }
    },
    {
      "id": "fe_deck_2",
      "prim": "box",
      "dims": [
        2.6,
        0.12,
        1.4
      ],
      "role": "landing",
      "zone": "iron",
      "attach": {
        "to": "mass_middle",
        "face": "+Z",
        "uv": [
          0.184211,
          0.333333
        ],
        "contact": "flush",
        "embed": 0.05,
        "align": "bottom"
      }
    },
    {
      "id": "fe_rail_2",
      "prim": "railing_open",
      "dims": [
        2.6,
        0.95,
        0.12
      ],
      "role": "railing",
      "zone": "iron",
      "params": {
        "postCount": 4,
        "railThickness": 0.12,
        "postThickness": 0.12
      },
      "attach": {
        "to": "fe_deck_2",
        "face": "+Y",
        "uv": [
          0.5,
          0.96
        ],
        "contact": "rests-on-top"
      }
    },
    {
      "id": "fe_stair_tread_1",
      "prim": "box",
      "dims": [
        0.29,
        0.12,
        1.2
      ],
      "role": "stair_tread",
      "zone": "iron",
      "attach": {
        "to": "mass_middle",
        "face": "+Z",
        "uv": [
          0.057895,
          0.354722
        ],
        "contact": "flush",
        "embed": 0.05
      }
    },
    {
      "id": "fe_stair_tread_2",
      "prim": "box",
      "dims": [
        0.29,
        0.12,
        1.2
      ],
      "role": "stair_tread",
      "zone": "iron",
      "attach": {
        "to": "mass_middle",
        "face": "+Z",
        "uv": [
          0.073684,
          0.371111
        ],
        "contact": "flush",
        "embed": 0.05
      }
    },
    {
      "id": "fe_stair_tread_3",
      "prim": "box",
      "dims": [
        0.29,
        0.12,
        1.2
      ],
      "role": "stair_tread",
      "zone": "iron",
      "attach": {
        "to": "mass_middle",
        "face": "+Z",
        "uv": [
          0.089474,
          0.3875
        ],
        "contact": "flush",
        "embed": 0.05
      }
    },
    {
      "id": "fe_stair_tread_4",
      "prim": "box",
      "dims": [
        0.29,
        0.12,
        1.2
      ],
      "role": "stair_tread",
      "zone": "iron",
      "attach": {
        "to": "mass_middle",
        "face": "+Z",
        "uv": [
          0.105263,
          0.403889
        ],
        "contact": "flush",
        "embed": 0.05
      }
    },
    {
      "id": "fe_stair_tread_5",
      "prim": "box",
      "dims": [
        0.29,
        0.12,
        1.2
      ],
      "role": "stair_tread",
      "zone": "iron",
      "attach": {
        "to": "mass_middle",
        "face": "+Z",
        "uv": [
          0.121053,
          0.420277
        ],
        "contact": "flush",
        "embed": 0.05
      }
    },
    {
      "id": "fe_stair_tread_6",
      "prim": "box",
      "dims": [
        0.29,
        0.12,
        1.2
      ],
      "role": "stair_tread",
      "zone": "iron",
      "attach": {
        "to": "mass_middle",
        "face": "+Z",
        "uv": [
          0.136842,
          0.436666
        ],
        "contact": "flush",
        "embed": 0.05
      }
    },
    {
      "id": "fe_stair_tread_7",
      "prim": "box",
      "dims": [
        0.29,
        0.12,
        1.2
      ],
      "role": "stair_tread",